{
  "organization_id": "11111111-1111-4111-8111-111111111111",
  "period_start": "2026-10-01",
  "settled_resolution_units": 0,
  "reserved_resolution_units": 0,
  "monthly_unit_limit": 5000,
  "waiting_units": {
    "fixture_io": 0,
    "parse": 0,
    "export": 0,
    "browser": 0,
    "http": 0
  },
  "active_units": {
    "fixture_io": 0,
    "parse": 0,
    "export": 0,
    "browser": 0,
    "http": 0
  },
  "source_resource_attempts": 0,
  "billing_implemented": false,
  "synthetic_only": true
}
